{
  "$schema": "https://json-schema.org/draft/2020-12/schema",
  "$id": "https://optees.org/schemas/simulator/v1/deferred_run_terminal_record.v1.json",
  "title": "DeferredRunTerminalRecord",
  "description": "Immutable record capturing final episode termination, cancellation, and terminal clearance of pending transitions under deferred settlement.",
  "type": "object",
  "required": [
    "$type",
    "schema_version",
    "terminal_record_id",
    "run_id",
    "episode_id",
    "terminal_status",
    "reason_code",
    "reason_message",
    "simulation_frontier_time",
    "execution_timestamp",
    "parent_round_hash",
    "policy_terminal_records",
    "terminal_state_merkle_hash"
  ],
  "additionalProperties": false,
  "properties": {
    "$type": {
      "type": "string",
      "const": "deferred_run_terminal_record"
    },
    "schema_version": {
      "type": "string",
      "const": "1.0.0"
    },
    "terminal_record_id": {
      "type": "string",
      "pattern": "^term_[a-zA-Z0-9_-]+$"
    },
    "run_id": {
      "type": "string",
      "pattern": "^ep-run_[a-zA-Z0-9_-]+$"
    },
    "episode_id": {
      "type": "string",
      "pattern": "^ep-def_[a-zA-Z0-9_-]+$"
    },
    "terminal_status": {
      "type": "string",
      "enum": [
        "COMPLETED",
        "CANCELLED"
      ]
    },
    "reason_code": {
      "type": "string",
      "enum": [
        "CLEAN_COMPLETION",
        "UNSETTLED_EPISODE_TERMINATION",
        "EPISODE_CANCELLED"
      ]
    },
    "reason_message": {
      "type": "string",
      "minLength": 1,
      "maxLength": 1000
    },
    "simulation_frontier_time": {
      "type": [
        "string",
        "null"
      ],
      "pattern": "^\\d{4}-\\d{2}-\\d{2}T\\d{2}:\\d{2}:\\d{2}(\\.\\d+)?Z$"
    },
    "execution_timestamp": {
      "type": "string",
      "pattern": "^\\d{4}-\\d{2}-\\d{2}T\\d{2}:\\d{2}:\\d{2}(\\.\\d+)?Z$"
    },
    "parent_round_hash": {
      "type": [
        "string",
        "null"
      ],
      "pattern": "^sha256:[a-f0-9]{64}$"
    },
    "policy_terminal_records": {
      "type": "array",
      "minItems": 1,
      "items": {
        "type": "object",
        "required": [
          "policy_id",
          "account_state_hash",
          "pending_transition_hash",
          "settlement_outcome_hash"
        ],
        "additionalProperties": false,
        "properties": {
          "policy_id": {
            "type": "string",
            "pattern": "^pol-def_[a-zA-Z0-9_-]+$"
          },
          "account_state_hash": {
            "type": "string",
            "pattern": "^sha256:[a-f0-9]{64}$"
          },
          "pending_transition_hash": {
            "type": [
              "string",
              "null"
            ],
            "pattern": "^sha256:[a-f0-9]{64}$"
          },
          "settlement_outcome_hash": {
            "type": [
              "string",
              "null"
            ],
            "pattern": "^sha256:[a-f0-9]{64}$"
          }
        },
        "allOf": [
          {
            "if": {
              "properties": {
                "pending_transition_hash": {
                  "type": "null"
                }
              }
            },
            "then": {
              "properties": {
                "settlement_outcome_hash": {
                  "type": "null"
                }
              }
            }
          },
          {
            "if": {
              "properties": {
                "pending_transition_hash": {
                  "type": "string"
                }
              }
            },
            "then": {
              "properties": {
                "settlement_outcome_hash": {
                  "type": "string"
                }
              }
            }
          }
        ]
      }
    },
    "terminal_state_merkle_hash": {
      "type": "string",
      "pattern": "^sha256:[a-f0-9]{64}$"
    }
  },
  "allOf": [
    {
      "if": {
        "properties": {
          "parent_round_hash": {
            "type": "null"
          }
        }
      },
      "then": {
        "properties": {
          "simulation_frontier_time": {
            "type": "null"
          },
          "terminal_status": {
            "const": "CANCELLED"
          },
          "reason_code": {
            "const": "EPISODE_CANCELLED"
          }
        }
      }
    },
    {
      "if": {
        "properties": {
          "terminal_status": {
            "const": "CANCELLED"
          }
        }
      },
      "then": {
        "properties": {
          "reason_code": {
            "const": "EPISODE_CANCELLED"
          }
        }
      }
    }
  ]
}
