{
  "$type": "deferred_run_terminal_record",
  "schema_version": "1.0.0",
  "terminal_record_id": "term_fc0a4b6ba5917f21a0fd1ebc76049b632c97032e7a1a069c70ea9d5c05c22c39",
  "run_id": "ep-run_00000001",
  "episode_id": "ep-def_00000001",
  "terminal_status": "COMPLETED",
  "reason_code": "CLEAN_COMPLETION",
  "reason_message": "All rounds completed cleanly with zero pending transitions.",
  "simulation_frontier_time": "2026-08-05T00:00:00Z",
  "execution_timestamp": "2026-08-05T00:00:01Z",
  "parent_round_hash": "sha256:1111111111111111111111111111111111111111111111111111111111111111",
  "policy_terminal_records": [
    {
      "policy_id": "pol-def_alpha",
      "account_state_hash": "sha256:aaaaaaaaaaaaaaaaaaaaaaaaaaaaaaaaaaaaaaaaaaaaaaaaaaaaaaaaaaaaaaaa",
      "pending_transition_hash": null,
      "settlement_outcome_hash": null
    },
    {
      "policy_id": "pol-def_beta",
      "account_state_hash": "sha256:bbbbbbbbbbbbbbbbbbbbbbbbbbbbbbbbbbbbbbbbbbbbbbbbbbbbbbbbbbbbbbbb",
      "pending_transition_hash": null,
      "settlement_outcome_hash": null
    }
  ],
  "terminal_state_merkle_hash": "sha256:0ae7630f59366bf293a6c924aaba4cb9a7b70146e870f0e4623153b88f5a631e"
}
